{
  "$schema": "https://json-schema.org/draft/2020-12/schema",
  "title": "Classifier token-id fixture",
  "description": "Token ids and marker positions produced by a model's own Python input builder, which sidekick's Rust port must reproduce exactly. Generated by the conversion tools; read by sidekick-embed's tests. See docs/design/classify.md.",
  "type": "object",
  "required": ["format", "model", "source", "tokenizer_sha256", "max_len", "cases"],
  "properties": {
    "format": {"const": 1},
    "model": {"type": "string", "description": "classifier.toml id"},
    "source": {
      "type": "object",
      "required": ["repo", "revision"],
      "properties": {"repo": {"type": "string"}, "revision": {"type": "string"}}
    },
    "tokenizer_sha256": {"type": "string", "description": "sha256 of the tokenizer.json the ids were produced with"},
    "max_len": {"type": "integer"},
    "cases": {
      "type": "array",
      "items": {
        "type": "object",
        "required": ["id", "input", "ids"],
        "properties": {
          "id": {"type": "string"},
          "input": {"type": "string", "description": "the text (laya: the state)"},
          "candidate_labels": {"type": "array", "items": {"type": "string"}},
          "question_type": {"enum": ["choice", "score", "noul"]},
          "instructions": {"type": ["string", "null"], "description": "null: the manifest default applies"},
          "ids": {"type": "array", "items": {"type": "integer"}},
          "markers": {"type": "array", "items": {"type": "integer"}},
          "qtype": {"type": ["integer", "null"]}
        }
      }
    }
  }
}
