{"format":1,"model":"nlptown-sentiment","source":{"repo":"nlptown/bert-base-multilingual-uncased-sentiment","revision":"8f6f4e3a8f70be4b65d3a4a8762b6d781cda240d"},"tokenizer_sha256":"11aaf894a4ccf3d95e8830e27c0f8152791fbbff2b988e29a265580b86edd216","max_len":512,"cases":[{"id":"doc-cat","input":"A cat sat on the mat.","ids":[101,143,15048,14790,10125,10103,12152,119,102]},{"id":"query-cat","input":"where do cats like to sleep","ids":[101,10982,10154,45670,11531,10114,32524,102]},{"id":"tiny-empty","input":"","ids":[101,102]},{"id":"tiny-emoji","input":"🙂","ids":[101,100,102]},{"id":"tiny-cjk","input":"猫","ids":[101,5641,102]},{"id":"tiny-number","input":"42","ids":[101,11437,102]},{"id":"delim-punctuation","input":"Wait... what?! (No, really: \"that\" isn't it.) [1] {2} <3>","ids":[101,41550,119,119,119,11523,136,106,113,10181,117,25165,131,107,10203,107,65148,112,162,10197,119,114,138,122,140,169,123,171,133,124,135,102]},{"id":"delim-bert-specials","input":"Question: what is it? [SEP] Answer: nothing at all. [CLS] [MASK] [PAD]","ids":[101,18722,131,11523,10127,10197,136,102,42942,131,20587,10160,10367,119,101,103,0,102]},{"id":"delim-decoder-specials","input":"first part </s> second part <eos> third part <|endoftext|> the end","ids":[101,10403,10649,133,120,161,135,10981,10649,133,51627,135,12047,10649,133,170,11421,43629,30754,10123,170,135,10103,11421,102]},{"id":"delim-newlines","input":"line one\n\n\n\nline two\n\n\n\n\n\nline three\n","ids":[101,11585,10399,11585,10536,11585,10916,102]},{"id":"degenerate-subword","input":"hahahahahahahahahahahahahahahahahahahahahahahahahahahahahahahahahahahahahahahaha","ids":[101,10240,72219,62459,72219,62459,72219,62459,72219,62459,72219,62459,72219,62459,72219,62459,72219,62459,72219,62459,72219,62459,72219,62459,72219,62459,72219,62459,102]},{"id":"code-python","input":"def add(a, b):\n    \"\"\"Return the sum.\"\"\"\n    return a + b  # simple helper\n\nprint(add(2, 3))\n","ids":[101,44160,33989,113,143,117,144,114,131,107,107,107,14142,10103,25049,119,107,107,107,14142,143,116,144,108,15511,14743,10177,24054,113,33989,113,123,117,124,114,114,102]},{"id":"code-json","input":"{\"id\": 48213, \"tags\": [\"a\", \"b\"], \"nested\": {\"ok\": true, \"value\": null, \"ratio\": 0.25}}","ids":[101,169,107,12249,107,131,42296,42299,117,107,15481,10107,107,131,138,107,143,107,117,107,144,107,140,117,107,22159,10163,107,131,169,107,13563,107,131,16222,117,107,18267,107,131,47985,117,107,25152,107,131,121,119,10280,171,171,102]},{"id":"numbers-url","input":"https://example.com/a/very/long/path/with/segments?query=string&and=more&session=abcdef0123456789#fragment","ids":[101,14540,131,120,120,14577,119,10241,120,143,120,12495,120,11134,120,26584,120,10171,120,54514,136,50292,10158,134,23910,111,10110,134,10772,111,23734,134,16081,10282,10481,66865,66349,72018,11325,11444,11544,11518,108,28199,102]},{"id":"ml-german","input":"Der schnelle braune Fuchs springt über den faulen Hund.","ids":[101,10118,35230,10111,19354,10111,55649,12679,10123,10859,10129,11403,35130,65714,119,102]},{"id":"ml-japanese","input":"東京は日本の首都であり、世界最大級の都市圏を形成している。","ids":[101,4501,1755,1538,4316,4465,1537,9486,8597,14424,1482,1666,5855,4446,2974,6566,1537,8597,3451,2761,1562,3624,3900,11764,1483,102]},{"id":"ml-arabic","input":"يعمل النموذج على تحويل النص إلى متجهات للبحث الدلالي.","ids":[101,58415,24177,10697,83309,10648,454,76946,14865,24177,93414,10967,476,48304,10797,10558,475,49756,72547,24177,42046,25770,119,102]},{"id":"ml-mixed","input":"Launch day 🚀🔥, ¡vamos! 日本語もOK. Ça marche ✅","ids":[101,25072,11111,100,117,173,90691,106,4316,4465,7852,1547,11243,119,10678,19220,100,102]}]}
